"What should be considered for data protection?",medical
"What are the main sources of household air pollution in developing countries?",medical
"Does WHO recommend a specific caesarean section rate at country level?",medical
"Are further versions of the handbook planned?",medical
"Headache disorders: How common are headaches?",medical
"Does radiation exposure pose a risk to foetuses?",medical
"What is the population attributable fraction?",medical
"What is clonorchiasis?",medical
"What should I do if I want to take part in clinical trial?",medical
"Who will be invited to participate in the forum?",medical
"Which species of snakes are responsible?",medical
"https://www.sciencedirect.com/science/article/pii/S0160412019331642?",medical
"How do children get exposed and how can the disease affect them?",medical
"5. What are some key tips for developing a GCF project proposal for health?",medical
"Is giving blood safe?",medical
"What are the determinants of health?",medical
"What are the socioeconomic consequences of snakebite?",medical
"Why are they called ‘neglected’?",medical
"How much meat is it safe to eat?",medical
"How can chikungunya be prevented?",medical
"How different are the new standards from the old growth charts?",medical
"What is the impact of the health worker shortage?",medical
"What does the EML antibiotic book add to AWaRe?",medical
"Should I get a vaccine or immunity certificate before travelling?",medical
"What measures can help me to prevent or delay the onset of hearing loss in my old age?",medical
"What should I do if I think I have been exposed to nerve agent?",medical
"How are guidelines put into practice and who checks on them?",medical
"What is artemisinin, and how are artemisinin-based combination therapies used to treat malaria?",medical
"Can pregnant or postpartum women living with HIV transmit the COVID-19 virus to their unborn child or infant?",medical
"I’m pregnant. How can I protect myself against COVID-19?",medical
"How many times should a trial be registered?",medical
"What are the symptoms of COVID-19?",medical
"Where does yellow fever occur?",medical
"Can the EML antibiotic book be adapted to the local setting?",medical
"The travel company is asking me to wear a mask while traveling. Which kind of mask should I use?",medical
"Could supplying vaccines in single-dose vials only be an option ?",medical
"B. VIA is performed as the primary screening test, no lesion is seen, but the transformation zone (TZ) is incompletely visualized?",medical
"I am a healthcare provider. I have heard that persons with COVID-19 may have increased risk of blood clots. How should I advise individuals who are using or want to use combined hormonal contraception?",medical
"What is the vision of the Task Force concerning the target product profiles (TPPs)?",medical
"What protection measures should people take when using disinfectants?",medical
"How much will the vaccine cost?",medical
"Does WHO work with partners?",medical
"Can SLCP emissions be reduced?",medical
"Why do we need a Zika virus country classification scheme?",medical
"How are the members of an IHR Emergency Committee chosen?",medical
"How can pregnant women protect themselves from mosquito bites?",medical
"What are potassium iodide pills?",medical
"Where are NTDs most prevalent?",medical
"Which trials should be registered?",medical
"What role does mosquito control play in addressing Zika virus?",medical
"Why is lead paint an important source of human exposure?",medical
"How can we protect others and ourselves if we don't know who is infected?",medical
"Is it easy to detect people who are infected with MERS-CoV?",medical
"What is a healthy diet for breastfeed babies and young children?",medical
"Are there pages on EMF in German, Italian and Swedish?",medical
"How was the vaccine developed?",medical
"What is Guillain-Barré syndrome?",medical
"What health resources can be affected by attacks on health care?",medical
"Is the risk higher in children, in elderly people, in women, or in men? Are some people more at risk?",medical
"What are pesticides?",medical
"How do people get infected with the MERS virus?",medical
"Do I need to see a health worker for self-care actions?",medical
"What are the challenges in calculating excess mortality including COVID-19?",medical
"What are the symptoms of MERS? How severe is it?",medical
"What general advice can be given to food consumers and producers in the event of a nuclear emergency?",medical
"Is suicide really a problem? How many people die by suicide every year?",medical
"I had the vaccination when I was a child. Am I still protected?",medical
"What is yaws?",medical
"What is WHO's role in nuclear emergencies?",medical
"How is the infection transmitted?",medical
"Disability: What is e-accessibility?",medical
"What concrete steps is the WHO taking against NTDs?",medical
"Q: What is Kangaroo Mother Care?",medical
"How do the treatment recommendations in the EML antibiotic book take into account settings where the prevalence of multidrug-resistant organisms is very high?",medical
"Who does ageism affect?",medical
"What is International Lead Poisoning Prevention Week?",medical
"How do foodborne diseases challenge public health security?",medical
"Who manages the vaccine supply for yellow fever outbreaks?",medical
"Why is WHO producing these estimates now, in the midst of the pandemic?",medical
"What would be the public health impact of restricting manufacture, distribution or use of thiomersal-containing vaccines ?",medical
"How were differences in the availability of supportive tools (e.g. imaging, diagnostics) taken into account in the development of the EML antibiotic book?",medical
"Why are more women giving birth by caesarean section nowadays?",medical
"How fast does smallpox spread?",medical
"How is echinococcosis diagnosed?",medical
"When can the EUL be used?",medical
"How many malaria-affected countries have reported cases of COVID-19?",medical
"What impact will this have on food and food production in Japan?",medical
"Where does trachoma occur?",medical
"How is diphtheria diagnosed?",medical
"What are the key considerations for healthy ageing?",medical
"Can clonorchiasis be treated?",medical
"WHO does not recommend travel restrictions related to avian influenza. However, travellers can take certain measures to reduce the risk of infection. Please see "How can human infections with avian influenza be prevented?",medical
"The main effect of radiofrequency energy is the heating of tissue. Consequently, exposure guidelines for radiofrequency fields and microwaves are set to prevent health effects caused by localized or whole-body heating (see What happens when you are exposed to electromagnetic fields?",medical
"Should I travel?",medical
"What is the recommended food for children in their very early years?",medical
"In which regions is the disease mostly found?",medical
"Why is the Checklist important?",medical
"What is WHO doing to stop the spread of antimalarial drug resistance in the Greater Mekong subregion?",medical
"What test should I get to see if I have COVID-19?",medical
"How to prevent Chagas disease?",medical
"How does pneumonic differ from bubonic plague?",medical
"How should I clean food items from the grocery store, for example fruit, vegetables or packaged items?",medical
"How does COVID-19 increase risks of violence for women?",medical
"How can I communicate effectively with the person with dementia?",medical
"Who are the important actors that can help implement the recommendations in the Guidelines?",medical
"How are people exposed to ionizing radiation?",medical
"What did the ECDD decide?",medical
"How are people appointed to the expert advisory panels?",medical
"What reference data should be used for children older than 5 years?",medical
"How do food products become radioactive?",medical
"What are the consequences of malnutrition?",medical
"Could supplying vaccines in multi-dose vials without a preservative be an option ?",medical
"Can we combat ageism?",medical
"What information can this tool give?",medical
"How is Chagas disease diagnosed?",medical
"Magnetic fields in everyday life: are they really that high?",medical
"Will this vaccine protect against all types of meningococcal disease?",medical
"2. What if I am unable to find an appropriate Accredited Entity to submit a health-related GCF project proposal?",medical
"What are the forms of the disease?",medical
"What is the double burden of malnutrition?",medical
"What about people who have had colon cancer? Should they stop eating red meat?",medical
"What are the symptoms of Chagas disease?",medical
"What is the oxygen saturation in a COVID-19 patient?",medical
"Why is it important to eat a variety of foods?",medical
"Can lymphatic filariasis be prevented?",medical
"https://www.sciencedirect.com/science/article/pii/S0160412019332118?",medical
"What are examples from the food and agriculture sector?",medical
"Is there an Ebola vaccine?",medical
"What is WHO's response to Zika?",medical
"How can I access and share global learning on quality of care?",medical
"What are the symptoms of Zika virus disease?",medical
"Is eradication of yellow fever possible?",medical
"What is excess mortality?",medical
"Why is environmental surveillance of wastewater important during disease outbreaks?",medical
"What actions are being taken to monitor the safety of food from Japan?",medical
"Are there any directives on office ventilation and air conditioning use?",medical
"What are examples from the industrial sectors?",medical
"What is health promotion?",medical
"What is chikungunya fever?",medical
"What is medicinal oxygen?",medical
"What is a public health emergency of international concern?",medical
"How can I spot an SF medical product?",medical
"What is dengue fever and severe dengue?",medical
"Biological effects or health effects? What is a health hazard?",medical
"Can pregnant women get vaccinated against COVID-19?",medical
"What is WHO doing to increase our understanding of health and ageing?",medical
"What are the main differences between 5G and previous technologies?",medical
"How does a registry become a Primary Registry in the WHO Registry Network?",medical
"How can it be prevented?",medical
"How important are used lead-acid batteries as a source of lead exposure?",medical
"When should trials be registered?",medical
"Why is WHO providing advice to the agriculture sector?",medical
"What are the main differences between rich and poor countries with respect to causes of death?",medical
"Are self-care interventions safe?",medical
"What is the Model Disability Survey used for?",medical
"What are some examples of foodborne diseases?",medical
"How can I protect myself from being infected with plague?",medical
"What is taeniasis and cysticercosis?",medical
"Who is at risk?",medical
"Why start with mass vaccination campaigns?",medical
"Is an ultrasound routinely required for the provision of abortion?",medical
"How many people attempt suicide every year?",medical
"How long does it take to develop symptoms?",medical
"When will the EML antibiotic book be made available?",medical
"What is WHO's guidance on certifying COVID-19 deaths?",medical
"Why is gender equality also men’s concern?",medical
"Hasn’t a recent study shown that the Checklist is not as effective as first thought?",medical
"What are the safest methods of cooking meat (e.g. sautéing, boiling, broiling, or barbecuing)?",medical
"What is Cannabidiol and is it safe?",medical
"What do the population attributable fraction (PAF) and the estimated attributable disease burden NOT cover?",medical
"Why are mourners at burial ceremonies considered at risk of contracting Ebola?",medical
"Can you guarantee that the SDG health targets will be reached if countries meet these spending levels?",medical
"How common is raised blood pressure?",medical
"Why register clinical trials?",medical
"I am safe, but I am suffering from mental / sexual / social / long-term physical health problems because of violence. Is there anyone who can help me during COVID-19?",medical
"Who is the handbook intended for?",medical
"How should employers decide when to open, close or re-open workplaces and/or suspend or downscale work activities?",medical
"Why do the estimates show negative excess deaths for some countries?",medical
"Is an easily accessible summary of the evidence available?",medical
"Are there any benefits other than reduced complications and death following surgery?",medical
"Does it hurt?",medical
"Why could caesarean sections be dangerous?",medical
"How feasible is it to eliminate lead in paint, and how important are regulations to restrict the use of lead in paint?",medical
"How feasible is it to monitor financial protection by household spending on health – what data are available and what expertise is needed?",medical
"Who spreads dengue and severe dengue?",medical
"Who are the members of an IHR Emergency Committee?",medical
"What is the impact of the Central Emergency Response Fund on WHO’s work?",medical
"What are foodborne diseases?",medical
"What is a refractive error?",medical
"How were the costs calculated?",medical
"What should I do if I think I have an SF medical product?",medical
"What needs to be done at the societal level?",medical
"Can I drink the tap water in Japan?",medical
"Why do vaccines need preservatives ?",medical
"What is the impact of mercury on health ?",medical
"What is the guidance for the disinfection of outdoor spaces such as open markets, roads?",medical
"How does the handbook relate to WHO’s work on patient safety and infection prevention and control?",medical
"If I have been exposed to radioactive material released into the environment, what should I do?",medical
"What are the challenges in Zika vaccine R&D?",medical
"What long-term effects can be expected from radiation exposure?",medical
"Why are the number of cases reported lower than the number of cases estimated?",medical
"What is asthma?",medical
"Could you quantify the risk of eating red meat and processed meat?",medical
"What are the limitations of these estimates and methods?",medical
"For whom is this tool useful?",medical
"What are the next steps?",medical
"What are examples around waste management?",medical
"Who is at risk for avian influenza?",medical
"Our surgical teams don’t want to use the WHO Surgical Safety Checklist unless they can change a few of the elements. Is it okay to make changes to the Checklist?",medical
"Is it safe to visit live poultry markets and farms?",medical
"Why are so many children involved in road traffic crashes?",medical
"Why is a standardized system to classify caesarean sections necessary?",medical
"What are the health risks associated with mobile phones and their base stations?",medical
"What additional measures should be taken at workplaces and for jobs at medium risk?",medical
"What are the consequences of attacks on health care?",medical
"WHO’s new road map: can it end the suffering from NTDs by 2030?",medical
"What other organizations could assist in responding to deliberate chemical release?",medical
"What do you consider as red meat?",medical
"Should all people who engage in gaming be concerned about developing gaming disorder?",medical
"What does WHO want to achieve through its advocacy work?",medical
"What are the symptoms of clonorchiasis?",medical
"How is trachoma diagnosed?",medical
"Who might be targeted for vaccination against Zika?",medical
"When and why should I take potassium iodide?",medical
"Will the evaluation of Covid-19 vaccines continue after the PHE is no longer in effect?",medical
"What about rapid tests?",medical
"What are the sources of human exposure to lead?",medical
"Who should participate in clinical trials for COVID-19 vaccines?",medical
"What is oxygen?",medical
"What are the signs and symptoms of lymphatic filariasis?",medical
"If I feel well but am in the high-risk category, should I travel?",medical
"What is e-accessibility?",medical
"What are the symptoms?",medical
"How does the IHR Emergency Committee work?",medical
"Can age-related hearing loss be reversed? Can it be treated?",medical
"How do we ensure human rights and reduce stigma and discrimination?",medical
"What is trial registration?",medical
"Are people normally exposed to ionizing radiation?",medical
"I want to introduce an electronic system for TB. Can you recommend me one, or will the Task Force be creating one for all programmes?",medical
"How is the empiric use of Reserve antibiotics covered in the EML antibiotic book?",medical
"Are exposures above the guidelines harmful?",medical
"How to monitor oxygen saturation of COVID-19 patients at home?",medical
"How is WHO expediting Zika vaccine R&D?",medical
"Has WHO published any guidance on the management of exposure to chemical weapons?",medical
"What precautions should I take during travel?",medical
"Can antiretrovirals or direct-acting antivirals against hepatitis C virus be used to treat COVID-19?",medical
"What is the FGM cost calculator?",medical
"What are the symptoms of intestinal schistosomiasis?",medical
"What can I do to protect myself if I think that a chemical has been released?",medical
"I have additional questions not covered by the FAQ. Can I speak to someone?",medical
"How long does it take for people to develop symptoms after being infected?",medical
"Is Guinea-worm disease fatal?",medical
"Meat products and eggs can be safely consumed, provided they are properly prepared because influenza viruses are inactivated by thorough cooking. Please see "How can meat and eggs be safely prepared?",medical
"What is the Checklist?",medical
"Why is leishmaniasis important?",medical
"What is the International Classification of Diseases?",medical
"Who is most at risk?",medical
"Are there international agreements about the use of pesticides?",medical
"How is medicinal oxygen stored and distributed?",medical
"What are self-care interventions?",medical
"How is clonorchiasis diagnosed?",medical
"What are some digital tools used to support contact tracing? How can they enhance contact tracing processes?",medical
"What does the ICTRP do?",medical
"Who is most impacted by snakebite?",medical
"How were the infections covered in the EML antibiotic book selected?",medical
"What is type 1 diabetes?",medical
"Should we eat only poultry and fish?",medical
"What happens when I give blood?",medical
"Who decides on guidelines?",medical
"Can schistosomiasis be treated?",medical
"What are different ways to measure catastrophic health expenditures?",medical
"Are there alternative preservatives that could be used for vaccines ?",medical
"Which parasite causes HAT?",medical
"What are typical exposure levels at home and in the environment?",medical
"1. Can I submit a full project proposal through WHO?",medical
"How is the parasite that causes HAT transmitted to humans?",medical
"Are men more affected than women?",medical
"Can Ebola be transmitted sexually?",medical
"I want to remove or replace my implant or IUD – can I do this during COVID-19 pandemic?",medical
"How does the use of antibiotics in food-producing animals lead to antimicrobial resistance in humans?",medical
"M. de Onis, T Lobstein. Defining obesity risk status in the general childhood population: Which cut-offs should we use?",medical
"How does the ICTRP support countries and regions?",medical
"What are the current standards?",medical
"Who makes the One Health approach work?",medical
"What is guinea worm? Is it a real worm?",medical
"How is echinococcosis treated?",medical
"Does the EUL provide for products developed after a public health emergency has been declared?",medical
"What are the potential health effects of consuming contaminated food?",medical
"Where is lymphatic filariasis most commonly found?",medical
"What is ageism?",medical
"What is typhoid fever?",medical
"What is healthy ageing?",medical
"What type of radiation exposure could occur in a nuclear power plant accident?",medical
"How does safe water impact global health?",medical
"What are the symptoms of plague?",medical
"What is schistosomiasis or bilharzia?",medical
"Which public health actions are most important to take?",medical
"Is the disease more complicated in women?",medical
"What are the effects of exposure to chlorine?",medical
"Do COVID-19 and tuberculosis spread in the same way?",medical
"What is hepatitis?",medical
"Has the vaccine been prequalified by WHO?",medical
"Are suicides preventable?",medical
"Who should not be vaccinated?",medical
"Why do the guidance levels for radioactive Iodine-131 in drinking water vary?",medical
"Does the handbook address disease and population specific quality initiatives, such as those for HIV and maternal and child health?",medical
"Why can’t we give water to a breastfeeding baby before the 6 months, even when it is hot?",medical
"What is the potential of genomics for public health?",medical
"Should core malaria vector control interventions be maintained in view of the rapid global spread of COVID-19?",medical
"In what settings is the EML antibiotic book intended to be used?",medical
"How are Leishmania parasites transmitted?",medical
"If I am in an area with an active plague outbreak, should I wear a mask to protect myself?",medical
"What is leishmaniasis?",medical
"As we have seen earlier, low frequency electromagnetic fields induce currents in the human body (see What happens when you are exposed to electromagnetic fields?",medical
"How to measure oxygen saturation?",medical
"What precautions are being followed?",medical
"What is the current status of dengue vaccine development?",medical
"When should I get a test for COVID-19?",medical
"Can unsafe abortions be prevented?",medical
"How can yaws be treated?",medical
"What are the signs and symptoms of visceral leishmaniasis (VL) and PKDL?",medical
"We already do all the things on the Checklist. Why should we use it?",medical
"How can we tackle NTDs?",medical
"How much blood will be taken? Will I have enough?",medical
"Why is gaming disorder being included in ICD-11?",medical
"What can I do to prevent infection?",medical
"What are recommendations?",medical
"Is this a WHO guideline?",medical
"What are the economic costs of lead paint?",medical
"Is it healthy to eat moderate amounts of fats and oils?",medical
"What is the difference between gender, sex, gender identity, gender expression and sexual orientation?",medical
"What are neurological disorders and how many people are affected by them?",medical
"Will 2030 really signal the end of suffering from NTDs?",medical
"How is wastewater testing used for COVID-19?",medical
"Can medical abortion be self-managed by the client herself?",medical
"What is meant by a fair price?",medical
"What regions are most impacted?",medical
"Should we memorize the Checklist?",medical
"How long might the health workforce crisis last?",medical
"Where do the diseases occur?",medical
"Do clinical trials continue after a product has been assessed and listed under the EUL procedure?",medical
"Which cut-offs should we use for defining obesity risk in children?",medical
"How can trachoma be prevented and controled?",medical
"Why is it important for policymakers?",medical
"Should the smallpox vaccine be widely used to protect people?",medical
"What events led WHO to investigate a causal link between Zika virus and complications including microcephaly and Guillian-Barré syndrome?",medical
"How does healthy ageing differ from active ageing?",medical
"What are examples from the energy sector?",medical
"Is there any guidance on the impact on the mental health of populations of exposure to chemical weapons?",medical
"What is the Global Alliance to Eliminate Lead Paint and what are its aims?",medical
"What is the WHO Global Task Force on e-/mHealth and TB and what is its mandate?",medical
"What is the situation regarding foodborne diseases in developed and developing countries?",medical
"What if a medicine recommended as first choice treatment option is not available in a given country?",medical
"Does the EUL procedure ensure rapid availability?",medical
"What is the treatment for dengue?",medical
"Where can I find more information on the work of the Task Force and how can I get involved in its work?",medical
"What are the potential health risks from 5G?",medical
"Will the standards be applicable to all children?",medical
"Where can I review the methodology used to calculate the estimates for each country?",medical
"Is tuberculosis treatment different in people who have both TB and COVID-19?",medical
"Does the handbook propose suggested indicators for measuring quality of care?",medical
"What information did the ECDD consider when making their decisions?",medical
"How can snakebite be prevented?",medical
"What is WHO’s position on the use of antiretrovirals for the treatment or prevention of COVID-19?",medical
"What are the latest statistics on health workforce availability? Why does the latest HRH report (A Universal Truth – No health without a Workforce, 2013) use a different threshold (33.45/10’000) from the WHO 2006 report(22.8/10’000)?",medical
"Is a vaccine currently available?",medical
"What is WHO's position on the use of thiomersal in vaccines ?",medical
"What is ionizing radiation?",medical
"Why are Chagas disease diagnosis indexes low?",medical
"Processed meat was classified as Group 1, carcinogenic to humans. What does this mean?",medical
"What is the EML antibiotic book?",medical
"How can I catch it and is it contagious?",medical
"What should you do if you think someone may have avian influenza?",medical
"What are some of the challenges to effective contact tracing for COVID-19?",medical
"What is WHO’s position on the use of Artemisia plant material for the prevention or treatment of malaria and/or COVID-19?",medical
"I want to avoid getting pregnant during the COVID-19 pandemic. What can I do?",medical
