"What is the timeline for vaccination campaigns across the meningitis belt?",medical
"What are the symptoms of sleeping sickness?",medical
"Do pregnant women with suspected or confirmed COVID-19 need to give birth by caesarean section?",medical
"Does addressing NTDs contribute to promote global health equity?",medical
"Why should people donate blood?",medical
"How common is asthma globally?",medical
"In the original pilot study, the reduction in mortality was not significant in high-income countries. Does the Checklist really apply to high-income countries?",medical
"Who is more likely agree that it is right for a man to beat his wife is she does something wrong?",medical
"How can health authorities ensure supplies of tuberculosis medicines and diagnostics?",medical
"What roles do older people take on in society?",medical
"Are there differences between the sleeping sickness caused by T.b. gambiense and T.b. rhodesiense?",medical
"What is raised blood pressure (hypertension)?",medical
"What is at the origin of the fair pricing forum – why now?",medical
"Can I register with the WHO ICTRP?",medical
"Are there other complications?",medical
"Is there a long-term plan to help the world prepare for influenza?",medical
"I am planning to attend a wedding and a party. What precautions should I take to protect myself and others from getting infected with COVID-19?",medical
"Is there a vaccine against avian influenza?",medical
"What is the aim of the HGE Registry?",medical
"Is there research ongoing to evaluate the relative effectiveness of alternative preservatives to thiomersal ?",medical
"What are neglected tropical diseases?",medical
"The vaccine - What is the expected public health impact of this new vaccine?",medical
"How do you diagnose plague?",medical
"Pricing Forum taking place?",medical
"Should tourists be concerned when traveling to countries that have schistosomiasis?",medical
"How will I feel after giving blood?",medical
"What is the EUL?",medical
"Can people with Ebola be cared for at home?",medical
"Why are some of the recommendation made with "low-quality evidence"?",medical
"Do health-care workers need to take extra precautions?",medical
"What are the recommendations using the “screen-triage-treat” approach if A. HPV as the primary screening test is positive, the VIA triage test reveals no lesion, but the transformation zone is incompletely visualized?",medical
"What are the different hepatitis viruses?",medical
"When people are advised to stay indoors, what does this mean?",medical
"Who is responsible for registering a trial?",medical
"Where do these pollutants come from?",medical
"Should people avoid contact with camels or camel products? Is it safe to visit farms, markets, or camel fairs?",medical
"How can raised blood pressure be prevented and treated?",medical
"What can be done to protect people from smallpox?",medical
"Can lymphatic filariasis be cured?",medical
"Can I give blood after vaccination against SARS-CoV-2?",medical
"What should women do if they wish to postpone pregnancy because they are worried about microcephaly?",medical
"How can meat and eggs be safely prepared?",medical
"What are the causes of childhood overweight and obesity?",medical
"What is malnutrition?",medical
"Is there a vaccine for MERS‐CoV? What is the treatment?",medical
"Who is funding these efforts in the GMS?",medical
"How can chemical weapons be disposed of or destroyed?",medical
"How can workplaces plan for the prevention and mitigation of COVID-19?",medical
"Does the Checklist apply to all low- and middle-income countries?",medical
"What should women do if they have been exposed to unprotected sex but do not wish to become pregnant because of possible infection with Zika?",medical
"How can I protect myself from typhoid fever?",medical
"How does this fair pricing initiative fit in with the GSPOA, CEWG and the UNHLP on access to medicines?",medical
"What should I do if I suspect I have plague?",medical
"What is overweight and obesity?",medical
"What is the risk of contracting COVID-19 in the workplace?",medical
"How was the Checklist developed?",medical
"Why are the WHO estimates different from estimates produced by others?",medical
"Is there any treatment for Ebola?",medical
"What are autism spectrum disorders?",medical
"What else is being addressed?",medical
"What types of cancers are linked or associated with eating red meat?",medical
"Where is it possible to find information on WHO in crises?",medical
"What is WHO doing to support malaria-affected countries in the context of COVID-19?",medical
"How is WHO supporting countries to strengthen national health information systems?",medical
"As a smoker, is my risk of getting the COVID-19 virus higher than that of a non-smoker?",medical
"Why is the disease burden attributable to risk factors being estimated?",medical
"What are the common health problems of refugees and migrants arriving in the European Region?",medical
"What are typical maximum exposure levels at home and in the environment?",medical
"Is it possible to track progress towards UHC?",medical
"How were FAO and OIE involved in the development of the guidelines?",medical
"What can I do to protect people from the risks associated with smoking, smokeless tobacco use and vaping?",medical
"What is being done to address malnutrition?",medical
"Does WHO recommend environmental surveillance of wastewater for COVID-19?",medical
"What are the international exposure guidelines?",medical
"I want to report an incidence of violence during COVID-19. What should I do?",medical
"What is lead paint?",medical
"Why do we specify human in African trypanosomiasis?",medical
"What are the rights, duties and responsibilities of workers?",medical
"How is Zika virus disease treated?",medical
"What information needs to be registered?",medical
"Can the Aedes mosquito travel from country to country and region to region?",medical
"How do I protect my health in a flood?",medical
"Funding shortfalls and cost-savings: How much money will be required to eliminate epidemic meningitis as a public health problem in sub-Saharan Africa?",medical
"Why is WHO particularly concerned about the spread of COVID-19 in malaria-affected areas?",medical
"What's in the future?",medical
"Can the return to the workplace be immediate after public measures are lifted?",medical
"I am a policy maker. What can I do to make sure people can access contraception and family planning information and services?",medical
"If I am pregnant, is it safe to take the drugs?",medical
"What definition of disability is used in the Model Disability Survey?",medical
"Has violence against women increased since the beginning of the COVID-19 pandemic?",medical
"Are there long-term effects of COVID-19?",medical
"Why is migration a problem for global health?",medical
"What can be done to fight the childhood obesity epidemic?",medical
"How was the Zika virus country classification scheme developed?",medical
"Which surface disinfectants are effective against COVID-19 in non-health care setting environments?",medical
"How can I implement the Robson classification in my hospital?",medical
"What are the findings from the additional analyses on long-term safety follow up stratified by serostatus at time of first vaccination?",medical
"Where can I find some examples of HTA reports?",medical
"What are the control strategies for leishmaniasis?",medical
"How do statistics improve health?",medical
"What is the extent of meningococcal disease in Africa?",medical
"Weren't the remaining stocks of the smallpox virus destroyed after smallpox was eradicated?",medical
"Have other studies supported the findings of the pilot study?",medical
"How is disability conceptualized in the MDS?",medical
"What are electromagnetic fields and where do they come from?",medical
"Would the answers to the above questions differ in WLHIV?",medical
"What can people do to protect themselves from mosquito bites?",medical
"What do you consider as processed meat?",medical
"Does nicotine use affect my chances in the context of COVID-19?",medical
"How does WHO monitor progress towards financial protection for UHC?",medical
"Poliomyelitis: Does polio still exist? Is it curable?",medical
"What is Chagas disease?",medical
"What are the key considerations for the workplace risk assessment?",medical
"What are guidelines based on?",medical
"How significant is the problem of infections in health care across the world?",medical
"Is harmful use of alcohol a public health problem?",medical
"What health challenges do preterm babies face?",medical
"What are the recommended practices once back home after outdoor activities?",medical
"What is trachoma?",medical
"[22] Effectiveness of interventions to address HIV in prisons. Geneva, World Health Organization, 2007(Evidence for Action Technical Papers) http://whqlibdoc.who.int/publications/2007/9789241596190_eng.pdf?",medical
"How can I respond to changes in the person with dementia?",medical
"What are the public health implications of this classification?",medical
"What should I do if I think that I have been exposed to a chemical weapon?",medical
"What is diphtheria?",medical
"I am a health worker. How can I help women survivors of violence during COVID-19?",medical
"Can food produced in other countries be affected by the events in Japan?",medical
"How is yaws diagnosed?",medical
"Why should I care about violence against women during COVID-19?",medical
"Are people with tuberculosis likely to be at increased risk of COVID-19 infection, illness and death?",medical
"What should I do if I think I have been exposed to mustard gas?",medical
"What mental health and psychosocial support should be provided to workers during COVID-19?",medical
"Why do we need a One Health approach?",medical
"How does WHO collect statistics?",medical
"What can Member States do to eliminate lead in paint?",medical
"When should contact tracing be implemented?",medical
"What is WHO’s health recommendation to prevent cancer risk associated with eating red meat and processed meat?",medical
"The disease - What is meningococcal disease?",medical
"What do we mean by availability, accessibility, acceptability and quality (AAAQ) of the health workforce?",medical
"How is WHO tackling the problem of lead and its effects on health?",medical
"How can I decontaminate myself?",medical
"My parents have hearing loss. What care should I take when speaking with them?",medical
"Why is it important to estimate the financial cost of female genital mutilation (FGM)?",medical
"Am I protected from yellow fever immediately following vaccination?",medical
"How does evidence-based approach work within health impact assessment?",medical
"Why is the population ageing?",medical
"Where have cases of MERS been identified?",medical
"What areas should be prioritized for disinfection in non-health care settings?",medical
"What care should be available during pregnancy and childbirth?",medical
"Can chemical weapons pose a threat to the food chain?",medical
"Processed meat was classified as carcinogenic to humans(Group 1). Tobacco smoking and asbestos are also both classified as carcinogenic to humans(Group 1). Does it mean that consumption of processed meat is as carcinogenic as tobacco smoking and asbestos?",medical
"Who is most at risk of severe illness from COVID-19?",medical
"What are the categories in the Zika virus country classification scheme?",medical
"I want to find out if I had COVID-19 in the past, what test could I take?",medical
"My team often stays together for the whole day. Must we introduce ourselves before every surgery?",medical
"Why are new standards needed?",medical
"Does WHO recommend thermal testing of people entering a workplace?",medical
"What additional special measures may be needed in the context of COVID-19?",medical
"Should I take iodized salt to protect myself from radiation?",medical
"What more can people and governments do to reduce the threat of antimalarial resistance in the GMS?",medical
"What are the characteristics of an ideal Zika vaccine?",medical
"I am a policy maker. What can I do to prevent and address violence against women during COVID-19?",medical
"What is the best contraceptive method to use during the COVID-19 pandemic?",medical
"Why does childhood overweight and obesity matter?",medical
"Why are the United States of America and other industrialized countries avoiding use of thiomersal in vaccines if there is no proven safety risk ?",medical
"How has WHO’s global action against NTDs evolved?",medical
"What does WHO recommend for tobacco users?",medical
"What treatment exists?",medical
"How can I register a trial?",medical
"What further support is available to countries developing national quality policy and strategy?",medical
"What is WHO doing to address FGM?",medical
"The right age to begin sexuality education is?",medical
"Red meat was classified as Group 2A, probably carcinogenic to humans. What does this mean exactly?",medical
"What is a pulse oximeter and how is it used?",medical
"How do people become infected with the Ebola virus?",medical
"Does this mean that cannabis-related substances should be available for medical use?",medical
"3. Détermination de nouveaux objectifs de gestion des expositions au plomb. Synthèse et recommandations. Paris: Haut Conseil de la santé publique; 2014 (http://www.hcsp.fr/explore.cgi/avisrapportsdomaine?",medical
"Are there any changes to WHO guidance with respect to malaria diagnosis and treatment?",medical
"What are the effects of exposure to mustard gas?",medical
"What are soil-transmitted helminths (STH)?",medical
"Can I get sick with COVID-19 from drinking water?",medical
"Water, sanitation and hygiene (WASH): How does safe water impact global health?",medical
"Are there other explanations for microcephaly and Guillain-Barré syndrome?",medical
"How does this link to countries’ national health planning processes?",medical
"Swedish: Vad är elektromagnetiska falt?",medical
"Does the BCG vaccine protect people from COVID-19?",medical
"What key measures to protect against COVID-19 should be undertaken in ALL workplaces?",medical
"Where does WHO get its funding for crises?",medical
"Why should food be fortified?",medical
"What is the Task Force doing to fulfill its mandate?",medical
"Where can I get more information?",medical
"Next steps - What are the Meningitis Vaccine Project's next steps?",medical
"Could I be screened when I exit or arrive at my destination?",medical
"How many experts were involved in the evaluation?",medical
"What is the scope of the HGE Registry?",medical
"How does genomics relate to global inequality?",medical
"If I am asked to take a COVID-19 test at my destination, how much will it cost?",medical
"Which organizations have policies on clinical trial registration?",medical
"Does WHO recommend a specific caesarean section rate at hospital level?",medical
"How can Guinea-worm disease be prevented?",medical
"Why has WHO undertaken the Attacks on Health Care initiative?",medical
"Can manufacturers afford to implement GMP?",medical
""There is no convincing evidence for an adverse health effect of electromagnetic fields" or "A cause-effect link between electromagnetic fields and cancer has not been confirmed" are typical of the conclusions that have been reached by expert committees that have examined the issue. This sounds as if science wanted to avoid giving an answer. Then why should research continue if scientists have already shown that there is no effect?",medical
"What is the treatment against leishmaniasis?",medical
"Does WHO have partnerships with non-UN organizations?",medical
"Is it a WHO or a South African initiative?",medical
"How can programmes assure continued access to HIV services?",medical
"Is it safe to travel to areas reporting human cases of avian influenza?",medical
"What health care access does WHO recommend for refugees and migrants?",medical
"What is the potential impact of COVID-19 pandemic on essential tuberculosis services?",medical
"What is AWaRe?",medical
"Which vaccines contain thiomersal ?",medical
"How do I reach out to others for help when caring for someone with dementia?",medical
"What is meant by attributable disease burden?",medical
"Can I take other forms of iodine?",medical
"Who is paying for the work of the Task Force?",medical
"What additional measures should be taken at workplaces and for jobs at high risk?",medical
"If I think I have STH, how do I treat them?",medical
"How common are autism spectrum disorders?",medical
"How is diphtheria spread?",medical
"How can these violations be prevented?",medical
"What are examples around urbanization?",medical
"What is WHO's role in the process of the Intergovernmental Negotiating Committee to prepare a global legally binding instrument on mercury (INC) ?",medical
"How soon can a vaccine against Covid-19 be assessed under the EUL?",medical
"Why does the scheme only take into consideration the presence in a country of the Aedes aegypti mosquito and not of other mosquitoes?",medical
"WHO is committed to improve understanding of progress towards financial protection by tracking how many people incur financial hardship, why, where, when and characterize who they are?",medical
"Can someone be infected with MERS-CoV and not be ill?",medical
"Which vaccines do not contain thiomersal ?",medical
"What is the additional value of the EML antibiotic book?",medical
"When is the ECDD expected to make its recommendations on the scheduling of cannabis?",medical
"Vaccines and immunization: What is vaccination?",medical
"What measures should be in place to protect staff working in tuberculosis laboratories and healthcare facilities, and community health workers, from COVID-19 infection?",medical
"What is antimicrobial resistance?",medical
"How to register a trial?",medical
"What does gender have to do with the health targets of the Sustainable Development Goals (SDGs)?",medical
"What is the WHO travel advice for Japan?",medical
"What are the effects of UV on the eye?",medical
"Who is the vector of Chagas disease?",medical
"Can countries afford it?",medical
"Where and in what formats will the EML antibiotic book be made available?",medical
"Does it occur naturally?",medical
"What is partial artemisinin resistance and how is it identified?",medical
"What is WHO’s role in this field?",medical
"What are the health impacts of food fortification?",medical
"What is the source of these recommendations?",medical
"Q: What is neonatal intensive care?",medical
"How can new vaccines have an impact?",medical
"What happens to people who get COVID-19?",medical
"What is WHO’s role within the humanitarian framework?",medical
"What should I do if I suspect I have dengue?",medical
"How can I successfully implement the Checklist in my hospital?",medical
"What process did the WHO follow to calculate the estimates?",medical
"What are the early indications of age related hearing loss (presbycusis)?",medical
"What are the health problems caused by STH?",medical
"What evidence/data will WHO use to argue for fairness in pricing?",medical
"How does UV effect the immune system?",medical
"My hospital is quite large, with many operating rooms. How can I implement a checklist in this environment?",medical
"What are attacks on health care?",medical
"What is a Primary Registry?",medical
"What are examples from the transport sector?",medical
"What is smallpox?",medical
"What happens once a vaccine is available?",medical
"How is the EML antibiotic book integrated with other WHO activities?",medical
"What is the relationship between Zika and microcephaly and Guillain-Barré syndrome?",medical
"What is intersectionality and why does it matter to gender and health?",medical
"What is the Attacks on Health Care Initiative?",medical
"Italian: Cosa sono i campi elettromagnetici?",medical
"What are the symptoms of the diseases?",medical
"What is gender?",medical
"What is WHO doing to address the public health implications of the large influxes of refugees and migrants into the European Region?",medical
"What are the acute health effects of radiation exposure?",medical
"Why did WHO stop clinical trials on hydroxychloroquine as a treatment for COVID-19?",medical
"Why is the safety factor for occupational exposure guidelines lower than for the general public?",medical
"Can antiretrovirals be used to prevent COVID-19 infection?",medical
"What is Middle East respiratory syndrome (MERS)?",medical
"Does WHO have evidence that using the Checklist has any benefit?",medical
"What is the SDG Health Price Tag?",medical
"Where does Zika virus occur?",medical
"What is the role of WHO in crises?",medical
"How is the research and development process being accelerated without compromising safety?",medical
"Can women transmit Zika virus to their fetuses during pregnancy or childbirth?",medical
"What is 'One Health'?",medical
"How do I get soil-transmitted helminths (STH)?",medical
"What needs to be done/addressed/changed/improved so that all children grow well according to these standards?",medical
"So what should my country spend on health?",medical
"How do people catch Zika virus?",medical
"How would I know if a chemical had been released?",medical
"A. HPV as the primary screening test is positive, and when acetic acid is placed on the cervix to determine treatment eligibility no lesion is seen, but the transformation zone (TZ) is incompletely visualized?",medical
"How early can an autism spectrum disorder be recognized in children?",medical
"Up to what age can a baby stay well nourished by just being breastfed?",medical
"How can violence against children be prevented?",medical
"What is the Global Health Workforce Alliance (The Alliance)?",medical
"Is contraception/ family planning safe to use during the COVID-19 pandemic?",medical
"Should tetanus immunizations be given to survivors with injuries in emergency situations?",medical
"Are public systems for disinfecting individuals such as spraying via tunnel or chambers safe to use?",medical
"What is the difference between different forms of oxygen therapy and delivery?",medical
"Funding shortfalls and cost-savings: What are the expected cost savings due to introduction of this new vaccine?",medical
"What is a preterm baby?",medical
"As a smoker, am I likely to get more severe symptoms if infected?",medical
"My hospital is very busy. Won’t the Checklist just waste time and make our operating theatres less efficient?",medical
"What are the reasons behind attacks on health care?",medical
"What can I do to avoid a heart attack or a stroke?",medical
"What does it mean when a wastewater sample tests positive for SARS-CoV-2?",medical
"Are there other consequences for development, beyond human health?",medical
