"What role does mosquito surveillance play in addressing Zika virus?",medical
"Are antibiotics effective in preventing or treating COVID-19?",medical
"How are taeniasis and cysticercosis diagnosed?",medical
"Will the EML antibiotic book be available in different languages?",medical
"Can I get sick with COVID-19 from swimming in the sea, rivers, lakes or swimming pools?",medical
"How do I volunteer for a COVID-19 vaccine trial?",medical
"How many cancer cases every year can be attributed to consumption of processed meat and red meat?",medical
"What is microcephaly?",medical
"What is Ebola virus disease?",medical
"Why should we act now?",medical
"When choosing a radio station on your stereo at home, have you ever wondered what the familiar abbreviations AM and FM stand for?",medical
"What is the appropriate first aid for snakebite?",medical
"What can be done to reduce the risk of acquiring dengue?",medical
"What causes lymphatic filariasis?",medical
"What advocacy work is WHO doing for the initiative?",medical
"While there is enthusiasm amongst some clinicians for the Checklist, there are others who do not see the value of this initiative. Can we still use the Checklist?",medical
"How can ventilation reduce the risk of contracting COVID-19 in airplanes?",medical
"Are SF medical products available on the internet?",medical
"What are the International Health Regulations?",medical
"How will the Task Force support countries to strengthen digital health efforts?",medical
"Can COVID-19 be transmitted at the workplace?",medical
"How does one get infected?",medical
"What are the results from the Phase 3 trials?",medical
"Why not measure financial protection by the number of people covered by health insurance or a public health system per 1000 population?",medical
"How are these two diseases treated?",medical
"What are the symptoms of STH?",medical
"Who should not travel?",medical
"How is it transmitted?",medical
"When and how should a child transition to other foods?",medical
"Data processes and analysis: The information collected from each contact is stored in a secure database. These processes vary from country to country. See question What should be considered for data protection?",medical
"Why is there a phased approached?",medical
"How is it diagnosed?",medical
"Will the EML antibiotic book be regularly updated in the future?",medical
"What is the difference between a pre-review and a critical review?",medical
"How else does gender link with health?",medical
"Why is hand hygiene still low after all the efforts to promote in recent years?",medical
"Have there been disruptions in the global supply of key malaria-related commodities as a result of the COVID-19 pandemic?",medical
"What is the Health Cluster?",medical
"Is it safe to eat meat or animal products, such as eggs, from areas with outbreaks of avian influenza?",medical
"How can the human rights of people with mental health conditions be promoted and protected?",medical
"I run a health facility. What can I do to support women survivors of violence during COVID-19?",medical
"What about using smokeless tobacco, like chewing tobacco?",medical
"How can existing vaccines have an impact?",medical
"What services can be leveraged across both diseases?",medical
"What are the costs associated with lead exposure?",medical
"How are overweight and obesity measured in children?",medical
"What should I do if I think I have been exposed to chlorine?",medical
"How is the attributable burden of disease due to a risk factor calculated?",medical
"How can I protect myself when handling or applying pesticides?",medical
"How many snakebites occur each year, and how many injuries/fatalities result from them?",medical
"What are the signs and symptoms?",medical
"How should I help someone who has been exposed to a chemical weapon?",medical
"What is oxygen therapy?",medical
"Is there commitment in Africa for the introduction of this vaccine?",medical
"Can Ebola be prevented?",medical
"Should we be vegetarians?",medical
"Why had cannabis never been reviewed until now?",medical
"How widespread are foodborne diseases?",medical
"How is the population attributable fraction calculated?",medical
"What emotional impact can a nuclear accident have on children? How can they be assisted?",medical
"Why does the Checklist work?",medical
"I am going on holiday to a country where I think worms are a problem, should I be concerned ?",medical
"What does it aim to achieve?",medical
"Polio is a disease you read about in history books. Does it still exist? Is it curable?",medical
"What does WHO recommend for self-care interventions?",medical
"How do you form a contact tracing workforce?",medical
"Are people living with HIV at increased risk of being infected with the virus that causes COVID-19?",medical
"What is the leading cause of death among 15-19 year old girls?",medical
"Who can give blood, and how often?",medical
"Are there any special precautions I should take after I arrive at my destination?",medical
"What are the key considerations for countries that are working to eliminate malaria or prevent re-establishment of transmission?",medical
"What are the signs and symptoms of cutaneous and mucocutaneous leishmaniasis?",medical
"Which health care workers can provide medical abortion services?",medical
"Are there rules for radioactivity in foods for international trade?",medical
"What is genomics?",medical
"What is WHO doing now?",medical
"How do you get yellow fever?",medical
"What is the overall goal of the treaty ?",medical
"What chemicals can be used as chemical weapons?",medical
"How do I avoid getting STH?",medical
"How is the parasite transmitted?",medical
"What is GMP?",medical
"Who should be in charge of running the Checklist?",medical
"I want to change my contraceptive method – is this possible?",medical
"In what ways will reducing emissions be beneficial for health?",medical
"What activities is WHO planning to help implement the use of the EML antibiotic book?",medical
"Do these new standards change current estimates of overweight and undernutrition in children?",medical
"What is the treatment against Chagas disease?",medical
"Why is excess mortality the preferred measure?",medical
"Should I use a digital contact tracing app while traveling?",medical
"What should people travelling to Zika-affected areas do?",medical
"What is the current status of Zika vaccine development?",medical
"Where does the disease occur?",medical
"Why does this tool focus on economic cost only?",medical
"What is WHO doing to advance gender equality and to mainstream gender across its work?",medical
"Does the concept of ‘fair pricing’ replace the principle of affordability?",medical
"How is leishmaniasis diagnosed?",medical
"What is a country consultation process and what are countries be consulted on?",medical
"Does stopping a course of antibiotics early lead to antibiotic resistance?",medical
"Why is food affected in areas beyond the evacuation zone?",medical
"Should pregnant and breastfeeding women living with HIV with COVID-19 and their newborns be managed differently?",medical
"Is eating raw meat safer?",medical
"What can people do to be protected from sexual transmission of Zika virus?",medical
"Violence against children: How can it be prevented?",medical
"Could the preservation method influence the risk (e.g. salting, deep-freezing, or irradiation)?",medical
"How will the elimination of lead paint contribute to achievement of the Sustainable Development Goals (SDGs)?",medical
"How is clonorchiasis transmitted?",medical
"Where can I find the estimates for my country / when will these estimates be available?",medical
"What is thiomersal ?",medical
"What is the role of Access antibiotics in the management of infections in primary care?",medical
"What evidence is there that Cannabidiol has value for medical use?",medical
"What is dual-use research of concern?",medical
"What effect does UV have on the skin?",medical
"What are the rights, duties and responsibilities of employers?",medical
"Where is Guinea-worm disease found?",medical
"What is the Model Disability Survey?",medical
"Does WHO recommend hydroxychloroquine to prevent COVID-19?",medical
"What is the difference between Health Impact Assessment and Health Technology Assessment?",medical
"How can plague be treated?",medical
"Should I stop eating meat?",medical
"Can it be treated?",medical
"What do the latest WHO/ILO figures show in relation to long working hours/overtime?",medical
"What is the key to successful implementation of the Checklist?",medical
"What is plague?",medical
"How were these estimates produced?",medical
"Who manages the yellow fever vaccine supply for routine immunization and preventive mass campaign?",medical
"How is lymphatic filariasis diagnosed?",medical
"What should be taken into consideration when setting a physical distance at the workplace?",medical
"Are health care workers at risk from MERS‐CoV?",medical
"What makes the various forms of electromagnetic fields so different?",medical
"Why are health-care workers at greater risk of catching Ebola?",medical
"Who is WHO working with on this initiative?",medical
"Can mothers with Zika infection breastfeed their baby?",medical
"Is the vaccine effective and safe?",medical
"Why is e-/mHealth (digital health) so important for TB prevention and care?",medical
"4. Where can I find examples of successful GCF project proposals?",medical
"Q: What kind of care do preterm babies need?",medical
"What should a person do if she/he has contact with a person who has MERS?",medical
"Are there treatments for COVID-19?",medical
"What are the treatment options?",medical
"Do travellers returning from Japan represent a health risk for others?",medical
"What to do when the patient is not eligible for ablation and colposcopy services are not available?",medical
"What steps are required to ensure that a vaccine is safe and effective?",medical
"Why is raised blood pressure dangerous?",medical
"Then why is smallpox being talked about now?",medical
"As a vaper, am I more likely to be infected or to have more severe symptoms if infected?",medical
"Can you provide more information on the studies reviewed by the Global Advisory Committee on Vaccine Safety ?",medical
"What should I do if I have been exposed to someone who has COVID-19?",medical
"Where in the world do the most bites occur?",medical
"I am a programme manager. What can I do to help people access contraception and family planning information and services?",medical
"What is Dengvaxia® (CYD-TDV)?",medical
"Contraceptive methods such as pills, injectables, implants and intrauterine devices have negative effects on the health of adolescent girls?",medical
"What is lead?",medical
"I am worried about someone I know. How can I help?",medical
"What should I do if I get sick while traveling?",medical
"Which countries are included in the tool?",medical
"What was the choice of antibiotic dose and treatment duration based on?",medical
"What is WHO's position on thiomersal-containing vaccines, as they pertain to the treaty ?",medical
"Why can’t a caesarean section rate at population level be applied or used at hospital level?",medical
"I need medical attention because of violence. Who can help me and where should I go?",medical
"Can I get sick with COVID-19 through contact with urine, faeces or sewage?",medical
"Can I touch and hold my newborn baby if I have COVID-19?",medical
"What is the ICTRP?",medical
"What can I do?",medical
"When might a Zika vaccine be available?",medical
"Why are self-care interventions important during health emergencies?",medical
"What would be the environmental impact of switching to single-dose vials only ?",medical
"What is type 2 diabetes?",medical
"Why is vaccination important for addressing antibiotic resistance?",medical
"What is the Humanitarian Reform and how does it affect WHO’s work?",medical
"I can’t access my contraceptive method of choice. What do you advise?",medical
"How can women manage their pregnancy in the context of Zika virus and complications?",medical
"What is the difference between a clinical trials register and a clinical trials registry?",medical
"What are WHO’s recommendations related to CYD-TDV?",medical
"How can I connect with other HTA groups?",medical
"I am organizing a gathering for family and friends. What steps can I take to make the event as safe as possible for my guests?",medical
"Are gloves recommended for the community in public spaces to protect against COVID-19, for example when going to the grocery store supermarket?",medical
"What is 5G?",medical
"How can we protect people seeking tuberculosis care during the COVID-19 pandemic?",medical
"How do I ensure that the person with dementia continues to receive care if I am no longer able to provide it?",medical
"Who are the members of the Technical Advisory Group (TAG) on COVID-19 Mortality Assessment?",medical
"What is the normal oxygen saturation for a healthy individual?",medical
"When should someone seek medical care?",medical
"Do the Guidelines call for a total ban of the preventive use of antibiotics in animals?",medical
"What progress has been achieved over the past decade?",medical
"Home is not a safe place for me. What can I do?",medical
"What is WHO doing?",medical
"Why has the handbook been produced?",medical
"Why should babies be breastfed exclusively?",medical
"What causes autism spectrum disorders?",medical
"Where do the mosquitoes breed?",medical
"How can people assess the risk for exposure to COVID-19 in their workplace and plan for preventive measures?",medical
"What are the symptoms of urogenital schistosomiasis?",medical
"Is ageism really a problem?",medical
"What is gaming disorder?",medical
"What is the deadliest disease in the world?",medical
"Are there travel restrictions due to MERS-CoV?",medical
"How are NTDs related to the SDGs?",medical
"What is the current risk of radiation-related health problems in Japan for those residing near the reactor in comparison to those in other parts of Japan?",medical
"Can tuberculosis and COVID-19 be tested on the same type of specimen?",medical
"Who should not give blood?",medical
"What are the elements of an enabling environment for self-care interventions?",medical
"What is oxygen saturation?",medical
"Which countries are most impacted?",medical
"Anti-theft systems in shops use tags that are detected by electrical coils at the exits. When a purchase is made the tags are removed or permanently deactivated. The electromagnetic fields from the coils do not generally exceed exposure guideline levels. Access control systems work in the same way with the tag incorporated into a key ring or identity card. Library security systems use tags that can be deactivated when a book is borrowed and reactivated when it is returned. Metal detectors and airport security systems set up a strong magnetic field of up to 100 µT that is disturbed by the presence of a metal object. Close to the frame of the detector, magnetic field strengths may approach and occasionally exceed guideline levels. However, this does not constitute a health hazard, as will be discussed in the section on guidelines. (see Are exposures above the guidelines harmful?",medical
"Why did IARC choose to evaluate red meat and processed meat?",medical
"What should health authorities do to provide sustainability of essential tuberculosis services during the COVID-19 pandemic?",medical
"Do dead bodies spread plague?",medical
"How is Chagas disease transmitted?",medical
"Can sleeping sickness be treated?",medical
"Should WHO-recommended preventive therapies be maintained in sub-Saharan Africa?",medical
"What are the requirements for applying the population attributable fraction (PAF) and what are its limitations?",medical
"How can I protect myself?",medical
"Are there health risks to people living outside of Japan from radiation emitted into the atmosphere from damaged Japanese nuclear power plants?",medical
"Why does the handbook not describe quality improvement methods?",medical
"Should pregnant women be tested for COVID-19?",medical
"Why is thiomersal in vaccines considered safe by WHO whereas mercury in some cosmetics is considered unsafe ?",medical
"What are the recommendations for breastfeeding women regarding potassium iodide?",medical
"What other interventions exist for dengue control?",medical
"What makes snakebite a “neglected tropical disease”?",medical
"Do people with an autism spectrum disorder always suffer from intellectual disability?",medical
"What is functional ability and how does it relate to healthy ageing?",medical
"Cardiovascular diseases: What is the deadliest disease in the world?",medical
"Can wastewater testing be conducted in low-resource settings?",medical
"What is lead poisoning?",medical
"What is the current state of research?",medical
"When should I get my ears tested?",medical
"How can I care for myself?",medical
"Why do results differ between different agencies?",medical
"Is there a risk of radioactive exposure from food contamination?",medical
"What are the main findings?",medical
"How do you hope that countries will use this tool?",medical
"Antimicrobial resistance: Does stopping a course of antibiotics early lead to antibiotic resistance?",medical
"Why is providing contraception/ family planning, as well as family planning services and information, important during the COVID-19 pandemic?",medical
"What are the types of plague and how do people become infected?",medical
"Who should be vaccinated?",medical
"What is the WHO doing to support monitoring?",medical
"What is the impact of SCLPs on health?",medical
"How do I cite a record on a clinical trials register?",medical
"Where is ageism seen?",medical
"How long does it take for leishmaniasis to develop after being infected?",medical
"Can radioactive contamination be removed from water?",medical
"Should all people being evaluated for tuberculosis also be tested for COVID-19 and vice-versa?",medical
"Do the eligibility criteria for EUL apply to COVID-19 products?",medical
"What is the status of drug resistance in the Greater Mekong subregion?",medical
"Who is most vulnerable?",medical
"Can COVID-19 be passed from a woman to her unborn or newborn baby?",medical
"What advantages does MenAfriVac have over existing polysaccharide meningococcal vaccines currently used to combat epidemics in Africa?",medical
"Where does yaws occur?",medical
"How common is chikungunya fever?",medical
"How is medicinal oxygen produced?",medical
"What was the choice of antibiotic treatment options for the different infections based on?",medical
"What is Legionnaires’ disease?",medical
"I have harmed or am worried about harming or hurting my partner (and children) with my words or actions. How can I stop?",medical
"How can I reduce my intake of salt and sugar?",medical
"What are the symptoms of dengue fever and severe dengue?",medical
"What is echinococcosis ?",medical
"What are human challenge studies? What is WHO’s view on these studies?",medical
"How do sex and gender influence health?",medical
"What are the typical signs and symptoms of Ebola virus infection?",medical
"What is congenital Zika virus syndrome?",medical
"How common are headaches?",medical
"What are gender mainstreaming and gender analysis?",medical
"Are childhood vaccines responsible for autism spectrum disorders?",medical
"What is not included in your estimates? What is missing?",medical
"Does WHO recommend workers wear masks at the workplace (office or others)? If yes, what type of masks?",medical
"How is Zika virus disease diagnosed?",medical
"What is chronic obstructive pulmonary disease (COPD)?",medical
"Why does the handbook focus on both policy and strategy?",medical
"How can human infections with avian influenza be prevented?",medical
"Is there a type of red meat that is safer?",medical
"What lessons does influenza preparedness offer for tackling respiratory pathogens and other diseases?",medical
"How does contact tracing work?",medical
"How does Guinea-worm disease spread?",medical
"What types of costs are included in the tool?",medical
"German: Was sind elektromagnetische Felder?",medical
"What are the risks of diabetes in children?",medical
"Is GMP necessary if there is a quality control laboratory?",medical
"Can / should health worker migration be stopped?",medical
"How will WHO interact with National Regulatory Authorities?",medical
"Does WHO need to evaluate a product that has already been approved by a WHO listed authority for use during public health emergencies ?",medical
"What types of cancers are linked or associated with eating processed meat?",medical
"How is diphtheria treated?",medical
"The WHO Expert Committee on Drug Dependence (ECDD) just held a special session on cannabis. Why is this important?",medical
"What does WHO recommend countries to do?",medical
"What is the difference between lymphatic filariasis and podoconiosis?",medical
"Are pesticides harmful to human health?",medical
"Which countries are most heavily affected?",medical
"What is the role of multi-month prescriptions and dispensing for antiretrovirals and other medicines?",medical
"Can you give an example of a country that established an influenza-monitoring programme, which was then used for other diseases?",medical
"What is self-care?",medical
"What causes asthma?",medical
"What are asthma attacks?",medical
"Does WHO recommend hydroxychloroquine as a treatment for COVID-19?",medical
"How can yaws be prevented?",medical
"Which inter-agency mechanisms WHO Emergency Risk Management and Humanitarian Response belongs to?",medical
"Is there a vaccine for COVID-19?",medical
"What are the mitigation actions?",medical
"Why is Trial Registration Important?",medical
"What is the difference between gender and sex?",medical
"How can I avoid SF medical products?",medical
"What happens when you are exposed to electromagnetic fields?",medical
"What issues related to ageing are WHO working on?",medical
"What should be done while research continues?",medical
"Why is antimicrobial resistance important for food safety?",medical
"What effective treatments exist for snakebite?",medical
"How does the EML antibiotic book help prescribers decide whether their patient needs antibiotics?",medical
"How is sleeping sickness diagnosed?",medical
"What can parents do to help their child with an autism spectrum disorder?",medical
"How is echinococcosis transmitted?",medical
"Who is defined as a contact?",medical
"What are examples from the housing sector?",medical
"How many studies were evaluated?",medical
"What are the effects of exposure to nerve agents?",medical
"Who should carry out the workplace risk assessment?",medical
"What are the health consequences?",medical
"Are diphtheria vaccines recommended?",medical
"What are the health effects of lead exposure?",medical
"What are the benefits of eating plenty of vegetables and fruit?",medical
"What are the clinical signs and how can trachoma be treated?",medical
"What is the difference between isolation and quarantine?",medical
"What should be the role of the EML antibiotic book in relation to existing local or national guidelines?",medical
"What are SLCPs?",medical
"What does WHO recommend with regard to vaccination for newly arrived migrants?",medical
"What is avian influenza?",medical
"What is backward contact tracing?",medical
"Can pregnant women take potassium iodide pills?",medical
"How were differences in the prevalence of antibiotic resistance among countries taken into account?",medical
"How is it treated?",medical
"What is COVID-19?",medical
"Will there be a short summary of the EML antibiotic book?",medical
"Why do costs not disappear when FGM is abandoned?",medical
"How can I provide everyday care to the person with dementia?",medical
"What are the tools available to implement the Robson classification in my hospital?",medical
"Why is GMP important?",medical
"What is WHO’s position on the use of chloroquine and hydroxychloroquine in the context of the COVID-19 response?",medical
"Stigma - Forgotten disease or forgotten population?",medical
"Is all food production in Japan affected by the nuclear emergency?",medical
"Can clonorchiasis be prevented?",medical
"What kind of information does the EML antibiotic book provide?",medical
"What is e-/mHealth?",medical
"Are there software or hardware specifications that should be followed for building a trial registry?",medical
"What should I do if I have COVID-19 symptoms?",medical
"What are the estimates based on?",medical
"How exactly does working long hours cause stroke and heart disease?",medical
"Why is zero tolerance of FGM so important?",medical
"What are the WHO recommendations for triage and screening of migrants upon arrival?",medical
"Does the amount of thiomersal in vaccines pose a health risk ?",medical
"How does the search filter work?",medical
"How are working hours expected to change due to the Covid-19 pandemic and in the future?",medical
"Why did you only include 67 countries?",medical
"Is this approach widely applied, accepted and tested?",medical
"3. What are the key impacts to be demonstrated for an adaptation project proposal?",medical
"Can pregnant women be treated with praziquantel?",medical
"What is lymphatic filariasis?",medical
"What is WHO’s role if chemical weapons are used?",medical
"What happens if I have symptoms while traveling or when I arrive at my destination?",medical
"How can chemical weapons be detected?",medical
"What can we do to mitigate the impacts of snakebite?",medical
"Should I get a COVID-19 test before departure or upon arrival?",medical
"What actions do you think governments should take based on your results?",medical
"Are pregnant women at higher risk from COVID-19?",medical
"What is meant by “essential travel”?",medical
"What if there are differences between the EML antibiotic book and existing WHO guidelines?",medical
